"No.","Time","Source","Destination","Protocol","Length","Info"
"1","0.000000","13.107.136.254","192.168.1.20","TCP","60","443  >  54759 [RST, ACK] Seq=1 Ack=1 Win=0 Len=0"
"3","1.125620","13.107.6.158","192.168.1.20","TCP","60","443  >  54765 [RST, ACK] Seq=1 Ack=1 Win=0 Len=0"
"6","2.246127","18.184.238.147","192.168.1.20","TCP","60","443  >  54137 [ACK] Seq=1 Ack=1 Win=27 Len=0"
"7","2.246221","192.168.1.20","18.184.238.147","TCP","54","[TCP ACKed unseen segment] 54137  >  443 [ACK] Seq=1 Ack=2 Win=512 Len=0"
"8","4.428220","192.168.1.20","35.186.224.25","TCP","55","54325  >  443 [ACK] Seq=1 Ack=1 Win=512 Len=1 [TCP segment of a reassembled PDU]"
"9","4.441157","35.186.224.25","192.168.1.20","TCP","66","443  >  54325 [ACK] Seq=1 Ack=2 Win=278 Len=0 SLE=1 SRE=2"
"11","5.581397","192.168.1.20","157.240.252.60","TLSv1.2","135","Application Data"
"13","5.648625","157.240.252.60","192.168.1.20","TCP","60","443  >  53114 [ACK] Seq=1 Ack=82 Win=985 Len=0"
"15","6.860535","18.184.238.147","192.168.1.20","TCP","60","443  >  54133 [ACK] Seq=1 Ack=1 Win=27 Len=0"
"16","6.860598","192.168.1.20","18.184.238.147","TCP","54","[TCP ACKed unseen segment] 54133  >  443 [ACK] Seq=1 Ack=2 Win=513 Len=0"
"17","7.253326","192.168.1.20","52.114.76.237","TLSv1.2","113","Application Data"
"18","7.330873","52.114.76.237","192.168.1.20","TLSv1.2","102","Application Data"
"19","7.376541","192.168.1.20","52.114.76.237","TCP","54","52807  >  443 [ACK] Seq=60 Ack=49 Win=256 Len=0"
"20","7.784182","192.168.1.20","146.75.58.248","TCP","55","54635  >  443 [ACK] Seq=1 Ack=1 Win=513 Len=1 [TCP segment of a reassembled PDU]"
"21","7.784312","192.168.1.20","146.75.58.248","TCP","55","54634  >  443 [ACK] Seq=1 Ack=1 Win=1026 Len=1 [TCP segment of a reassembled PDU]"
"22","7.830974","192.168.1.20","146.75.58.248","TCP","55","54424  >  443 [ACK] Seq=1 Ack=1 Win=513 Len=1 [TCP segment of a reassembled PDU]"
"23","7.846024","192.168.1.20","146.75.58.248","TCP","55","54620  >  443 [ACK] Seq=1 Ack=1 Win=513 Len=1 [TCP segment of a reassembled PDU]"
"24","7.864138","146.75.58.248","192.168.1.20","TCP","66","443  >  54635 [ACK] Seq=1 Ack=2 Win=319 Len=0 SLE=1 SRE=2"
"25","7.864138","146.75.58.248","192.168.1.20","TCP","66","443  >  54634 [ACK] Seq=1 Ack=2 Win=310 Len=0 SLE=1 SRE=2"
"26","7.900388","146.75.58.248","192.168.1.20","TCP","66","443  >  54424 [ACK] Seq=1 Ack=2 Win=308 Len=0 SLE=1 SRE=2"
"27","7.928373","146.75.58.248","192.168.1.20","TCP","66","443  >  54620 [ACK] Seq=1 Ack=2 Win=297 Len=0 SLE=1 SRE=2"
"28","8.191512","142.251.37.74","192.168.1.20","TLSv1.2","153","Application Data"
"29","8.238135","192.168.1.20","142.251.37.74","TCP","54","52811  >  443 [ACK] Seq=1 Ack=100 Win=259 Len=0"
"30","8.306440","192.168.1.20","146.75.58.248","TLSv1.2","820","Application Data"
"31","8.393753","146.75.58.248","192.168.1.20","TLSv1.2","769","Application Data"
"32","8.393753","146.75.58.248","192.168.1.20","TCP","1510","443  >  54657 [ACK] Seq=716 Ack=767 Win=410 Len=1456 [TCP segment of a reassembled PDU]"
"33","8.393832","192.168.1.20","146.75.58.248","TCP","54","54657  >  443 [ACK] Seq=767 Ack=2172 Win=2053 Len=0"
"34","8.398365","146.75.58.248","192.168.1.20","TCP","1510","443  >  54657 [ACK] Seq=2172 Ack=767 Win=410 Len=1456 [TCP segment of a reassembled PDU]"
"35","8.398365","146.75.58.248","192.168.1.20","TCP","1510","443  >  54657 [PSH, ACK] Seq=3628 Ack=767 Win=410 Len=1456 [TCP segment of a reassembled PDU]"
"36","8.398365","146.75.58.248","192.168.1.20","TCP","1510","443  >  54657 [ACK] Seq=5084 Ack=767 Win=410 Len=1456 [TCP segment of a reassembled PDU]"
"37","8.398365","146.75.58.248","192.168.1.20","TCP","1510","443  >  54657 [ACK] Seq=6540 Ack=767 Win=410 Len=1456 [TCP segment of a reassembled PDU]"
"38","8.398365","146.75.58.248","192.168.1.20","TCP","1510","443  >  54657 [PSH, ACK] Seq=7996 Ack=767 Win=410 Len=1456 [TCP segment of a reassembled PDU]"
"39","8.398365","146.75.58.248","192.168.1.20","TCP","1510","443  >  54657 [ACK] Seq=9452 Ack=767 Win=410 Len=1456 [TCP segment of a reassembled PDU]"
"40","8.398365","146.75.58.248","192.168.1.20","TCP","1510","443  >  54657 [ACK] Seq=10908 Ack=767 Win=410 Len=1456 [TCP segment of a reassembled PDU]"
"41","8.398365","146.75.58.248","192.168.1.20","TCP","1510","443  >  54657 [PSH, ACK] Seq=12364 Ack=767 Win=410 Len=1456 [TCP segment of a reassembled PDU]"
"42","8.398365","146.75.58.248","192.168.1.20","TCP","1510","443  >  54657 [ACK] Seq=13820 Ack=767 Win=410 Len=1456 [TCP segment of a reassembled PDU]"
"43","8.398365","146.75.58.248","192.168.1.20","TCP","1510","443  >  54657 [ACK] Seq=15276 Ack=767 Win=410 Len=1456 [TCP segment of a reassembled PDU]"
"44","8.398365","146.75.58.248","192.168.1.20","TLSv1.2","1510","Application Data"
"45","8.398365","146.75.58.248","192.168.1.20","TCP","1510","443  >  54657 [ACK] Seq=18188 Ack=767 Win=410 Len=1456 [TCP segment of a reassembled PDU]"
"46","8.398365","146.75.58.248","192.168.1.20","TCP","1510","443  >  54657 [ACK] Seq=19644 Ack=767 Win=410 Len=1456 [TCP segment of a reassembled PDU]"
"47","8.398365","146.75.58.248","192.168.1.20","TCP","1510","443  >  54657 [PSH, ACK] Seq=21100 Ack=767 Win=410 Len=1456 [TCP segment of a reassembled PDU]"
"48","8.398365","146.75.58.248","192.168.1.20","TCP","1510","443  >  54657 [ACK] Seq=22556 Ack=767 Win=410 Len=1456 [TCP segment of a reassembled PDU]"
"49","8.398365","146.75.58.248","192.168.1.20","TCP","1510","443  >  54657 [ACK] Seq=24012 Ack=767 Win=410 Len=1456 [TCP segment of a reassembled PDU]"
"50","8.398365","146.75.58.248","192.168.1.20","TCP","1510","443  >  54657 [PSH, ACK] Seq=25468 Ack=767 Win=410 Len=1456 [TCP segment of a reassembled PDU]"
"51","8.398365","146.75.58.248","192.168.1.20","TCP","1510","443  >  54657 [ACK] Seq=26924 Ack=767 Win=410 Len=1456 [TCP segment of a reassembled PDU]"
"52","8.398365","146.75.58.248","192.168.1.20","TCP","1510","443  >  54657 [ACK] Seq=28380 Ack=767 Win=410 Len=1456 [TCP segment of a reassembled PDU]"
"53","8.398506","192.168.1.20","146.75.58.248","TCP","54","54657  >  443 [ACK] Seq=767 Ack=29836 Win=2053 Len=0"
"54","8.398814","146.75.58.248","192.168.1.20","TCP","1510","443  >  54657 [PSH, ACK] Seq=29836 Ack=767 Win=410 Len=1456 [TCP segment of a reassembled PDU]"
"55","8.398814","146.75.58.248","192.168.1.20","TCP","1510","443  >  54657 [ACK] Seq=31292 Ack=767 Win=410 Len=1456 [TCP segment of a reassembled PDU]"
"56","8.398814","146.75.58.248","192.168.1.20","TLSv1.2","1510","Application Data"
"57","8.398814","146.75.58.248","192.168.1.20","TCP","1510","443  >  54657 [PSH, ACK] Seq=34204 Ack=767 Win=410 Len=1456 [TCP segment of a reassembled PDU]"
"58","8.398877","192.168.1.20","146.75.58.248","TCP","54","54657  >  443 [ACK] Seq=767 Ack=35660 Win=2053 Len=0"
"59","8.400448","146.75.58.248","192.168.1.20","TCP","1510","443  >  54657 [ACK] Seq=35660 Ack=767 Win=410 Len=1456 [TCP segment of a reassembled PDU]"
"60","8.400448","146.75.58.248","192.168.1.20","TCP","1510","443  >  54657 [ACK] Seq=37116 Ack=767 Win=410 Len=1456 [TCP segment of a reassembled PDU]"
"61","8.400448","146.75.58.248","192.168.1.20","TCP","1510","443  >  54657 [PSH, ACK] Seq=38572 Ack=767 Win=410 Len=1456 [TCP segment of a reassembled PDU]"
"62","8.400448","146.75.58.248","192.168.1.20","TCP","1510","443  >  54657 [ACK] Seq=40028 Ack=767 Win=410 Len=1456 [TCP segment of a reassembled PDU]"
"63","8.400513","192.168.1.20","146.75.58.248","TCP","54","54657  >  443 [ACK] Seq=767 Ack=41484 Win=2053 Len=0"
"64","8.401571","146.75.58.248","192.168.1.20","TCP","1510","443  >  54657 [ACK] Seq=41484 Ack=767 Win=410 Len=1456 [TCP segment of a reassembled PDU]"
"65","8.401571","146.75.58.248","192.168.1.20","TCP","1510","443  >  54657 [PSH, ACK] Seq=42940 Ack=767 Win=410 Len=1456 [TCP segment of a reassembled PDU]"
"66","8.401571","146.75.58.248","192.168.1.20","TCP","1510","443  >  54657 [ACK] Seq=44396 Ack=767 Win=410 Len=1456 [TCP segment of a reassembled PDU]"
"67","8.401571","146.75.58.248","192.168.1.20","TCP","1510","443  >  54657 [ACK] Seq=45852 Ack=767 Win=410 Len=1456 [TCP segment of a reassembled PDU]"
"68","8.401643","192.168.1.20","146.75.58.248","TCP","54","54657  >  443 [ACK] Seq=767 Ack=47308 Win=2053 Len=0"
"69","8.402274","146.75.58.248","192.168.1.20","TCP","1510","443  >  54657 [PSH, ACK] Seq=47308 Ack=767 Win=410 Len=1456 [TCP segment of a reassembled PDU]"
"70","8.402274","146.75.58.248","192.168.1.20","TLSv1.2","1510","Application Data"
"71","8.402323","192.168.1.20","146.75.58.248","TCP","54","54657  >  443 [ACK] Seq=767 Ack=50220 Win=2053 Len=0"
"72","8.404123","146.75.58.248","192.168.1.20","TCP","1510","443  >  54657 [ACK] Seq=50220 Ack=767 Win=410 Len=1456 [TCP segment of a reassembled PDU]"
"73","8.404123","146.75.58.248","192.168.1.20","TCP","1510","443  >  54657 [PSH, ACK] Seq=51676 Ack=767 Win=410 Len=1456 [TCP segment of a reassembled PDU]"
"74","8.404123","146.75.58.248","192.168.1.20","TCP","1510","443  >  54657 [ACK] Seq=53132 Ack=767 Win=410 Len=1456 [TCP segment of a reassembled PDU]"
"75","8.404123","146.75.58.248","192.168.1.20","TCP","1510","443  >  54657 [ACK] Seq=54588 Ack=767 Win=410 Len=1456 [TCP segment of a reassembled PDU]"
"76","8.404123","146.75.58.248","192.168.1.20","TCP","1510","443  >  54657 [PSH, ACK] Seq=56044 Ack=767 Win=410 Len=1456 [TCP segment of a reassembled PDU]"
"77","8.404123","146.75.58.248","192.168.1.20","TCP","1510","443  >  54657 [ACK] Seq=57500 Ack=767 Win=410 Len=1456 [TCP segment of a reassembled PDU]"
"78","8.404224","192.168.1.20","146.75.58.248","TCP","54","54657  >  443 [ACK] Seq=767 Ack=58956 Win=2053 Len=0"
"79","8.405347","146.75.58.248","192.168.1.20","TCP","1510","443  >  54657 [ACK] Seq=58956 Ack=767 Win=410 Len=1456 [TCP segment of a reassembled PDU]"
"80","8.405347","146.75.58.248","192.168.1.20","TCP","1510","443  >  54657 [PSH, ACK] Seq=60412 Ack=767 Win=410 Len=1456 [TCP segment of a reassembled PDU]"
"81","8.405347","146.75.58.248","192.168.1.20","TLSv1.2","1510","Application Data"
"82","8.405347","146.75.58.248","192.168.1.20","TCP","1510","443  >  54657 [ACK] Seq=63324 Ack=767 Win=410 Len=1456 [TCP segment of a reassembled PDU]"
"83","8.405347","146.75.58.248","192.168.1.20","TCP","1510","443  >  54657 [PSH, ACK] Seq=64780 Ack=767 Win=410 Len=1456 [TCP segment of a reassembled PDU]"
"84","8.405408","192.168.1.20","146.75.58.248","TCP","54","54657  >  443 [ACK] Seq=767 Ack=66236 Win=2053 Len=0"
"85","8.406463","146.75.58.248","192.168.1.20","TCP","1510","443  >  54657 [ACK] Seq=66236 Ack=767 Win=410 Len=1456 [TCP segment of a reassembled PDU]"
"86","8.406463","146.75.58.248","192.168.1.20","TCP","1510","443  >  54657 [ACK] Seq=67692 Ack=767 Win=410 Len=1456 [TCP segment of a reassembled PDU]"
"87","8.406463","146.75.58.248","192.168.1.20","TCP","1510","443  >  54657 [PSH, ACK] Seq=69148 Ack=767 Win=410 Len=1456 [TCP segment of a reassembled PDU]"
"88","8.406463","146.75.58.248","192.168.1.20","TCP","1510","443  >  54657 [ACK] Seq=70604 Ack=767 Win=410 Len=1456 [TCP segment of a reassembled PDU]"
"89","8.406504","192.168.1.20","146.75.58.248","TCP","54","54657  >  443 [ACK] Seq=767 Ack=72060 Win=2053 Len=0"
"90","8.408751","146.75.58.248","192.168.1.20","TCP","1510","443  >  54657 [ACK] Seq=72060 Ack=767 Win=410 Len=1456 [TCP segment of a reassembled PDU]"
"91","8.408751","146.75.58.248","192.168.1.20","TCP","1510","443  >  54657 [PSH, ACK] Seq=73516 Ack=767 Win=410 Len=1456 [TCP segment of a reassembled PDU]"
"92","8.408751","146.75.58.248","192.168.1.20","TCP","1510","443  >  54657 [ACK] Seq=74972 Ack=767 Win=410 Len=1456 [TCP segment of a reassembled PDU]"
"93","8.408751","146.75.58.248","192.168.1.20","TCP","1510","443  >  54657 [ACK] Seq=76428 Ack=767 Win=410 Len=1456 [TCP segment of a reassembled PDU]"
"94","8.408751","146.75.58.248","192.168.1.20","TLSv1.2","1510","Application Data"
"95","8.408751","146.75.58.248","192.168.1.20","TCP","1510","443  >  54657 [ACK] Seq=79340 Ack=767 Win=410 Len=1456 [TCP segment of a reassembled PDU]"
"96","8.408751","146.75.58.248","192.168.1.20","TCP","1510","443  >  54657 [PSH, ACK] Seq=80796 Ack=767 Win=410 Len=1456 [TCP segment of a reassembled PDU]"
"97","8.408801","192.168.1.20","146.75.58.248","TCP","54","54657  >  443 [ACK] Seq=767 Ack=82252 Win=2053 Len=0"
"98","8.409896","146.75.58.248","192.168.1.20","TCP","1510","443  >  54657 [ACK] Seq=82252 Ack=767 Win=410 Len=1456 [TCP segment of a reassembled PDU]"
"99","8.409896","146.75.58.248","192.168.1.20","TCP","1510","443  >  54657 [ACK] Seq=83708 Ack=767 Win=410 Len=1456 [TCP segment of a reassembled PDU]"
"100","8.409896","146.75.58.248","192.168.1.20","TCP","1510","443  >  54657 [PSH, ACK] Seq=85164 Ack=767 Win=410 Len=1456 [TCP segment of a reassembled PDU]"
"101","8.409896","146.75.58.248","192.168.1.20","TCP","1510","443  >  54657 [ACK] Seq=86620 Ack=767 Win=410 Len=1456 [TCP segment of a reassembled PDU]"
"102","8.409896","146.75.58.248","192.168.1.20","TCP","1510","443  >  54657 [ACK] Seq=88076 Ack=767 Win=410 Len=1456 [TCP segment of a reassembled PDU]"
"103","8.409896","146.75.58.248","192.168.1.20","TCP","1510","443  >  54657 [PSH, ACK] Seq=89532 Ack=767 Win=410 Len=1456 [TCP segment of a reassembled PDU]"
"104","8.409935","192.168.1.20","146.75.58.248","TCP","54","54657  >  443 [ACK] Seq=767 Ack=90988 Win=2053 Len=0"
"105","8.412865","146.75.58.248","192.168.1.20","TCP","1510","443  >  54657 [ACK] Seq=90988 Ack=767 Win=410 Len=1456 [TCP segment of a reassembled PDU]"
"106","8.412865","146.75.58.248","192.168.1.20","TCP","1510","443  >  54657 [ACK] Seq=92444 Ack=767 Win=410 Len=1456 [TCP segment of a reassembled PDU]"
"107","8.412865","146.75.58.248","192.168.1.20","TLSv1.2","1510","Application Data"
"108","8.412865","146.75.58.248","192.168.1.20","TCP","1510","443  >  54657 [ACK] Seq=95356 Ack=767 Win=410 Len=1456 [TCP segment of a reassembled PDU]"
"109","8.412865","146.75.58.248","192.168.1.20","TCP","1510","443  >  54657 [ACK] Seq=96812 Ack=767 Win=410 Len=1456 [TCP segment of a reassembled PDU]"
"110","8.412865","146.75.58.248","192.168.1.20","TCP","1510","443  >  54657 [PSH, ACK] Seq=98268 Ack=767 Win=410 Len=1456 [TCP segment of a reassembled PDU]"
"111","8.412865","146.75.58.248","192.168.1.20","TCP","1510","443  >  54657 [ACK] Seq=99724 Ack=767 Win=410 Len=1456 [TCP segment of a reassembled PDU]"
"112","8.412865","146.75.58.248","192.168.1.20","TCP","1510","443  >  54657 [ACK] Seq=101180 Ack=767 Win=410 Len=1456 [TCP segment of a reassembled PDU]"
"113","8.412865","146.75.58.248","192.168.1.20","TCP","1510","443  >  54657 [PSH, ACK] Seq=102636 Ack=767 Win=410 Len=1456 [TCP segment of a reassembled PDU]"
"114","8.412944","192.168.1.20","146.75.58.248","TCP","54","54657  >  443 [ACK] Seq=767 Ack=104092 Win=2053 Len=0"
"115","8.414754","146.75.58.248","192.168.1.20","TCP","1510","443  >  54657 [ACK] Seq=104092 Ack=767 Win=410 Len=1456 [TCP segment of a reassembled PDU]"
"116","8.414754","146.75.58.248","192.168.1.20","TCP","1510","443  >  54657 [ACK] Seq=105548 Ack=767 Win=410 Len=1456 [TCP segment of a reassembled PDU]"
"117","8.414754","146.75.58.248","192.168.1.20","TCP","1510","443  >  54657 [PSH, ACK] Seq=107004 Ack=767 Win=410 Len=1456 [TCP segment of a reassembled PDU]"
"118","8.414754","146.75.58.248","192.168.1.20","TCP","1510","443  >  54657 [ACK] Seq=108460 Ack=767 Win=410 Len=1456 [TCP segment of a reassembled PDU]"
"119","8.414754","146.75.58.248","192.168.1.20","TCP","1510","443  >  54657 [ACK] Seq=109916 Ack=767 Win=410 Len=1456 [TCP segment of a reassembled PDU]"
"120","8.414754","146.75.58.248","192.168.1.20","TLSv1.2","1510","Application Data"
"121","8.414819","192.168.1.20","146.75.58.248","TCP","54","54657  >  443 [ACK] Seq=767 Ack=112828 Win=2053 Len=0"
"122","8.418626","146.75.58.248","192.168.1.20","TCP","1510","443  >  54657 [ACK] Seq=112828 Ack=767 Win=410 Len=1456 [TCP segment of a reassembled PDU]"
"123","8.418626","146.75.58.248","192.168.1.20","TCP","1510","443  >  54657 [ACK] Seq=114284 Ack=767 Win=410 Len=1456 [TCP segment of a reassembled PDU]"
"124","8.418698","192.168.1.20","146.75.58.248","TCP","54","54657  >  443 [ACK] Seq=767 Ack=115740 Win=2053 Len=0"
"125","8.419062","146.75.58.248","192.168.1.20","TCP","1510","443  >  54657 [PSH, ACK] Seq=115740 Ack=767 Win=410 Len=1456 [TCP segment of a reassembled PDU]"
"126","8.419062","146.75.58.248","192.168.1.20","TCP","1510","443  >  54657 [ACK] Seq=117196 Ack=767 Win=410 Len=1456 [TCP segment of a reassembled PDU]"
"127","8.419062","146.75.58.248","192.168.1.20","TCP","1510","443  >  54657 [ACK] Seq=118652 Ack=767 Win=410 Len=1456 [TCP segment of a reassembled PDU]"
"128","8.419062","146.75.58.248","192.168.1.20","TCP","1510","443  >  54657 [PSH, ACK] Seq=120108 Ack=767 Win=410 Len=1456 [TCP segment of a reassembled PDU]"
"129","8.419062","146.75.58.248","192.168.1.20","TCP","1510","443  >  54657 [ACK] Seq=121564 Ack=767 Win=410 Len=1456 [TCP segment of a reassembled PDU]"
"130","8.419062","146.75.58.248","192.168.1.20","TCP","1510","443  >  54657 [ACK] Seq=123020 Ack=767 Win=410 Len=1456 [TCP segment of a reassembled PDU]"
"131","8.419062","146.75.58.248","192.168.1.20","TLSv1.2","1510","Application Data"
"132","8.419062","146.75.58.248","192.168.1.20","TCP","1510","443  >  54657 [ACK] Seq=125932 Ack=767 Win=410 Len=1456 [TCP segment of a reassembled PDU]"
"133","8.419062","146.75.58.248","192.168.1.20","TCP","1510","443  >  54657 [ACK] Seq=127388 Ack=767 Win=410 Len=1456 [TCP segment of a reassembled PDU]"
"134","8.419062","146.75.58.248","192.168.1.20","TCP","1510","443  >  54657 [PSH, ACK] Seq=128844 Ack=767 Win=410 Len=1456 [TCP segment of a reassembled PDU]"
"135","8.419062","146.75.58.248","192.168.1.20","TCP","1510","443  >  54657 [ACK] Seq=130300 Ack=767 Win=410 Len=1456 [TCP segment of a reassembled PDU]"
"136","8.419140","192.168.1.20","146.75.58.248","TCP","54","54657  >  443 [ACK] Seq=767 Ack=131756 Win=2053 Len=0"
"137","8.419809","146.75.58.248","192.168.1.20","TCP","1510","443  >  54657 [ACK] Seq=131756 Ack=767 Win=410 Len=1456 [TCP segment of a reassembled PDU]"
"138","8.419809","146.75.58.248","192.168.1.20","TCP","1510","443  >  54657 [PSH, ACK] Seq=133212 Ack=767 Win=410 Len=1456 [TCP segment of a reassembled PDU]"
"139","8.419879","192.168.1.20","146.75.58.248","TCP","54","54657  >  443 [ACK] Seq=767 Ack=134668 Win=2053 Len=0"
"140","8.422087","146.75.58.248","192.168.1.20","TCP","1510","443  >  54657 [ACK] Seq=134668 Ack=767 Win=410 Len=1456 [TCP segment of a reassembled PDU]"
"141","8.422087","146.75.58.248","192.168.1.20","TCP","1510","443  >  54657 [ACK] Seq=136124 Ack=767 Win=410 Len=1456 [TCP segment of a reassembled PDU]"
"142","8.422087","146.75.58.248","192.168.1.20","TCP","1510","443  >  54657 [PSH, ACK] Seq=137580 Ack=767 Win=410 Len=1456 [TCP segment of a reassembled PDU]"
"143","8.422087","146.75.58.248","192.168.1.20","TCP","1510","443  >  54657 [ACK] Seq=139036 Ack=767 Win=410 Len=1456 [TCP segment of a reassembled PDU]"
"144","8.422087","146.75.58.248","192.168.1.20","TLSv1.2","1510","Application Data"
"145","8.422087","146.75.58.248","192.168.1.20","TCP","1510","443  >  54657 [PSH, ACK] Seq=141948 Ack=767 Win=410 Len=1456 [TCP segment of a reassembled PDU]"
"146","8.422087","146.75.58.248","192.168.1.20","TCP","1510","443  >  54657 [ACK] Seq=143404 Ack=767 Win=410 Len=1456 [TCP segment of a reassembled PDU]"
"147","8.422087","146.75.58.248","192.168.1.20","TCP","1510","443  >  54657 [PSH, ACK] Seq=144860 Ack=767 Win=410 Len=1456 [TCP segment of a reassembled PDU]"
"148","8.422087","146.75.58.248","192.168.1.20","TCP","1510","443  >  54657 [ACK] Seq=146316 Ack=767 Win=410 Len=1456 [TCP segment of a reassembled PDU]"
"149","8.422087","146.75.58.248","192.168.1.20","TCP","1510","443  >  54657 [ACK] Seq=147772 Ack=767 Win=410 Len=1456 [TCP segment of a reassembled PDU]"
"150","8.422087","146.75.58.248","192.168.1.20","TCP","1510","443  >  54657 [PSH, ACK] Seq=149228 Ack=767 Win=410 Len=1456 [TCP segment of a reassembled PDU]"
"151","8.422163","192.168.1.20","146.75.58.248","TCP","54","54657  >  443 [ACK] Seq=767 Ack=150684 Win=2053 Len=0"
"152","8.423358","146.75.58.248","192.168.1.20","TCP","1510","443  >  54657 [ACK] Seq=150684 Ack=767 Win=410 Len=1456 [TCP segment of a reassembled PDU]"
"153","8.423358","146.75.58.248","192.168.1.20","TCP","1510","443  >  54657 [ACK] Seq=152140 Ack=767 Win=410 Len=1456 [TCP segment of a reassembled PDU]"
"154","8.423358","146.75.58.248","192.168.1.20","TCP","1510","443  >  54657 [PSH, ACK] Seq=153596 Ack=767 Win=410 Len=1456 [TCP segment of a reassembled PDU]"
"155","8.423396","192.168.1.20","146.75.58.248","TCP","54","54657  >  443 [ACK] Seq=767 Ack=155052 Win=2053 Len=0"
"156","8.424478","146.75.58.248","192.168.1.20","TCP","1510","443  >  54657 [ACK] Seq=155052 Ack=767 Win=410 Len=1456 [TCP segment of a reassembled PDU]"
"157","8.424478","146.75.58.248","192.168.1.20","TLSv1.2","1510","Application Data"
"158","8.424478","146.75.58.248","192.168.1.20","TCP","1510","443  >  54657 [PSH, ACK] Seq=157964 Ack=767 Win=410 Len=1456 [TCP segment of a reassembled PDU]"
"159","8.424503","192.168.1.20","146.75.58.248","TCP","54","54657  >  443 [ACK] Seq=767 Ack=159420 Win=2053 Len=0"
"160","8.425485","146.75.58.248","192.168.1.20","TCP","1510","443  >  54657 [ACK] Seq=159420 Ack=767 Win=410 Len=1456 [TCP segment of a reassembled PDU]"
"161","8.425485","146.75.58.248","192.168.1.20","TCP","1510","443  >  54657 [ACK] Seq=160876 Ack=767 Win=410 Len=1456 [TCP segment of a reassembled PDU]"
"162","8.425485","146.75.58.248","192.168.1.20","TCP","1510","443  >  54657 [PSH, ACK] Seq=162332 Ack=767 Win=410 Len=1456 [TCP segment of a reassembled PDU]"
"163","8.425485","146.75.58.248","192.168.1.20","TCP","1510","443  >  54657 [ACK] Seq=163788 Ack=767 Win=410 Len=1456 [TCP segment of a reassembled PDU]"
"164","8.425516","192.168.1.20","146.75.58.248","TCP","54","54657  >  443 [ACK] Seq=767 Ack=165244 Win=2053 Len=0"
"165","8.427218","146.75.58.248","192.168.1.20","TLSv1.2","1179","Application Data"
"166","8.472147","192.168.1.20","146.75.58.248","TCP","54","54657  >  443 [ACK] Seq=767 Ack=166369 Win=2048 Len=0"
"167","8.472923","192.168.1.20","52.112.238.252","TLSv1.2","112","Application Data"
"168","8.543929","52.112.238.252","192.168.1.20","TLSv1.2","101","Application Data"
"169","8.595356","192.168.1.20","52.112.238.252","TCP","54","52920  >  443 [ACK] Seq=59 Ack=48 Win=511 Len=0"
"170","9.454395","192.168.1.20","146.75.58.248","TCP","55","54649  >  443 [ACK] Seq=1 Ack=1 Win=513 Len=1 [TCP segment of a reassembled PDU]"
"171","9.526253","146.75.58.248","192.168.1.20","TCP","66","443  >  54649 [ACK] Seq=1 Ack=2 Win=293 Len=0 SLE=1 SRE=2"
"183","10.159821","192.168.1.20","20.199.120.151","TCP","55","52824  >  443 [ACK] Seq=1 Ack=1 Win=515 Len=1 [TCP segment of a reassembled PDU]"
"184","10.206924","192.168.1.20","20.199.120.151","TLSv1.2","98","Application Data"
"185","10.242253","20.199.120.151","192.168.1.20","TCP","66","443  >  52824 [ACK] Seq=1 Ack=2 Win=7369 Len=0 SLE=1 SRE=2"
"186","10.267828","20.199.120.151","192.168.1.20","TLSv1.2","229","Application Data"
"187","10.316457","192.168.1.20","20.199.120.151","TCP","54","52810  >  443 [ACK] Seq=45 Ack=176 Win=258 Len=0"
"188","10.644841","192.168.1.20","146.75.58.248","TCP","55","54633  >  443 [ACK] Seq=1 Ack=1 Win=508 Len=1 [TCP segment of a reassembled PDU]"
"190","10.707593","192.168.1.20","18.184.238.147","TCP","55","54134  >  443 [ACK] Seq=1 Ack=1 Win=513 Len=1 [TCP segment of a reassembled PDU]"
"191","10.707688","192.168.1.20","18.184.238.147","TCP","55","[TCP Keep-Alive] 54137  >  443 [ACK] Seq=0 Ack=2 Win=512 Len=1"
"192","10.720778","146.75.58.248","192.168.1.20","TCP","66","443  >  54633 [ACK] Seq=1 Ack=2 Win=301 Len=0 SLE=1 SRE=2"
"193","10.773884","18.184.238.147","192.168.1.20","TCP","66","443  >  54134 [ACK] Seq=1 Ack=2 Win=27 Len=0 SLE=1 SRE=2"
"194","10.773884","18.184.238.147","192.168.1.20","TCP","66","[TCP Previous segment not captured] 443  >  54137 [ACK] Seq=2 Ack=1 Win=27 Len=0 SLE=0 SRE=1"
"195","10.910860","192.168.1.20","146.75.58.248","TCP","55","54622  >  443 [ACK] Seq=1 Ack=1 Win=1026 Len=1 [TCP segment of a reassembled PDU]"
"196","10.996242","146.75.58.248","192.168.1.20","TCP","66","443  >  54622 [ACK] Seq=1 Ack=2 Win=308 Len=0 SLE=1 SRE=2"
"197","11.458709","192.168.1.20","172.217.22.65","TCP","55","54230  >  443 [ACK] Seq=1 Ack=1 Win=512 Len=1 [TCP segment of a reassembled PDU]"
"198","11.469976","172.217.22.65","192.168.1.20","TCP","66","443  >  54230 [ACK] Seq=1 Ack=2 Win=282 Len=0 SLE=1 SRE=2"
"199","11.550895","192.168.1.20","142.251.142.202","TCP","55","54132  >  443 [ACK] Seq=1 Ack=1 Win=511 Len=1 [TCP segment of a reassembled PDU]"
"200","11.560092","142.251.142.202","192.168.1.20","TCP","66","443  >  54132 [ACK] Seq=1 Ack=2 Win=333 Len=0 SLE=1 SRE=2"
"201","11.878550","18.184.238.147","192.168.1.20","TCP","60","[TCP Keep-Alive] 443  >  54134 [ACK] Seq=0 Ack=2 Win=27 Len=0"
"202","11.878616","192.168.1.20","18.184.238.147","TCP","54","[TCP Keep-Alive ACK] 54134  >  443 [ACK] Seq=2 Ack=1 Win=513 Len=0"
"203","13.032895","192.168.1.20","146.75.57.51","TCP","55","54714  >  443 [ACK] Seq=1 Ack=1 Win=509 Len=1 [TCP segment of a reassembled PDU]"
"204","13.109389","146.75.57.51","192.168.1.20","TCP","66","443  >  54714 [ACK] Seq=1 Ack=2 Win=293 Len=0 SLE=1 SRE=2"
"205","14.358275","192.168.1.20","157.240.252.60","TCP","1446","53114  >  443 [ACK] Seq=82 Ack=1 Win=512 Len=1392 [TCP segment of a reassembled PDU]"
"206","14.358275","192.168.1.20","157.240.252.60","TCP","1446","53114  >  443 [ACK] Seq=1474 Ack=1 Win=512 Len=1392 [TCP segment of a reassembled PDU]"
"207","14.358275","192.168.1.20","157.240.252.60","TCP","1446","53114  >  443 [ACK] Seq=2866 Ack=1 Win=512 Len=1392 [TCP segment of a reassembled PDU]"
"208","14.358275","192.168.1.20","157.240.252.60","TCP","1446","53114  >  443 [ACK] Seq=4258 Ack=1 Win=512 Len=1392 [TCP segment of a reassembled PDU]"
"209","14.358275","192.168.1.20","157.240.252.60","TLSv1.2","865","Application Data"
"210","14.424172","157.240.252.60","192.168.1.20","TCP","60","443  >  53114 [ACK] Seq=1 Ack=1474 Win=996 Len=0"
"211","14.425401","157.240.252.60","192.168.1.20","TCP","60","443  >  53114 [ACK] Seq=1 Ack=4258 Win=1017 Len=0"
"212","14.425401","157.240.252.60","192.168.1.20","TCP","60","443  >  53114 [ACK] Seq=1 Ack=6461 Win=1035 Len=0"
"213","14.432901","192.168.1.20","142.250.102.188","TCP","55","52866  >  443 [ACK] Seq=1 Ack=1 Win=511 Len=1 [TCP segment of a reassembled PDU]"
"214","14.507783","142.250.102.188","192.168.1.20","TCP","66","443  >  52866 [ACK] Seq=1 Ack=2 Win=265 Len=0 SLE=1 SRE=2"
"215","14.526204","192.168.1.20","142.251.142.202","TCP","55","54139  >  443 [ACK] Seq=1 Ack=1 Win=508 Len=1 [TCP segment of a reassembled PDU]"
"216","14.621560","157.240.252.61","192.168.1.20","TCP","1446","5222  >  53063 [ACK] Seq=1 Ack=1 Win=589 Len=1392 [TCP segment of a reassembled PDU]"
"217","14.621560","157.240.252.61","192.168.1.20","TCP","90","5222  >  53063 [PSH, ACK] Seq=1393 Ack=1 Win=589 Len=36 [TCP segment of a reassembled PDU]"
"218","14.621659","192.168.1.20","157.240.252.61","TCP","54","53063  >  5222 [ACK] Seq=1 Ack=1429 Win=516 Len=0"
"219","14.625713","157.240.252.60","192.168.1.20","TLSv1.2","165","Application Data"
"220","14.625713","157.240.252.61","192.168.1.20","TCP","1446","5222  >  53063 [ACK] Seq=1429 Ack=1 Win=589 Len=1392 [TCP segment of a reassembled PDU]"
"221","14.625713","157.240.252.61","192.168.1.20","TCP","153","5222  >  53063 [PSH, ACK] Seq=2821 Ack=1 Win=589 Len=99 [TCP segment of a reassembled PDU]"
"222","14.625805","192.168.1.20","157.240.252.61","TCP","54","53063  >  5222 [ACK] Seq=1 Ack=2920 Win=516 Len=0"
"223","14.635145","157.240.252.61","192.168.1.20","TCP","1446","5222  >  53063 [ACK] Seq=2920 Ack=1 Win=589 Len=1392 [TCP segment of a reassembled PDU]"
"224","14.635145","157.240.252.61","192.168.1.20","TCP","162","5222  >  53063 [PSH, ACK] Seq=4312 Ack=1 Win=589 Len=108 [TCP segment of a reassembled PDU]"
"225","14.635214","192.168.1.20","157.240.252.61","TCP","54","53063  >  5222 [ACK] Seq=1 Ack=4420 Win=516 Len=0"
"226","14.644576","157.240.252.61","192.168.1.20","TCP","1446","5222  >  53063 [ACK] Seq=4420 Ack=1 Win=589 Len=1392 [TCP segment of a reassembled PDU]"
"227","14.644576","157.240.252.61","192.168.1.20","TCP","645","5222  >  53063 [PSH, ACK] Seq=5812 Ack=1 Win=589 Len=591 [TCP segment of a reassembled PDU]"
"228","14.644765","192.168.1.20","157.240.252.61","TCP","54","53063  >  5222 [ACK] Seq=1 Ack=6403 Win=516 Len=0"
"229","14.666756","192.168.1.20","157.240.252.60","TCP","54","53114  >  443 [ACK] Seq=6461 Ack=112 Win=511 Len=0"
"230","14.673047","192.168.1.20","157.240.252.61","TCP","117","53063  >  5222 [PSH, ACK] Seq=1 Ack=6403 Win=516 Len=63 [TCP segment of a reassembled PDU]"
"231","14.736155","157.240.252.61","192.168.1.20","TCP","60","5222  >  53063 [ACK] Seq=6403 Ack=64 Win=589 Len=0"
"232","14.760046","192.168.1.20","204.79.197.203","TCP","54","54767  >  443 [FIN, ACK] Seq=1 Ack=1 Win=1019 Len=0"
"233","14.768121","204.79.197.203","192.168.1.20","TCP","60","443  >  54767 [ACK] Seq=1 Ack=2 Win=16381 Len=0"
"234","14.768121","204.79.197.203","192.168.1.20","TCP","60","443  >  54767 [FIN, ACK] Seq=1 Ack=2 Win=16381 Len=0"
"235","14.768215","192.168.1.20","204.79.197.203","TCP","54","54767  >  443 [ACK] Seq=2 Ack=2 Win=1019 Len=0"
"236","14.883846","192.168.1.20","35.186.224.18","TCP","55","54537  >  443 [ACK] Seq=1 Ack=1 Win=511 Len=1 [TCP segment of a reassembled PDU]"
"237","14.886534","157.240.252.60","192.168.1.20","TLSv1.2","149","Application Data"
"238","14.889083","192.168.1.20","157.240.252.60","TLSv1.2","147","Application Data"
"239","14.897142","35.186.224.18","192.168.1.20","TCP","66","443  >  54537 [ACK] Seq=1 Ack=2 Win=534 Len=0 SLE=1 SRE=2"
"240","14.952785","157.240.252.60","192.168.1.20","TCP","60","443  >  53114 [ACK] Seq=207 Ack=6554 Win=1035 Len=0"
"241","15.154453","157.240.252.60","192.168.1.20","TLSv1.2","148","Application Data"
"242","15.155915","192.168.1.20","157.240.252.60","TLSv1.2","147","Application Data"
"243","15.221790","157.240.252.60","192.168.1.20","TCP","60","443  >  53114 [ACK] Seq=301 Ack=6647 Win=1035 Len=0"
"245","17.100334","18.184.238.147","192.168.1.20","TCP","60","443  >  54135 [ACK] Seq=1 Ack=1 Win=27 Len=0"
"246","17.100396","192.168.1.20","18.184.238.147","TCP","54","[TCP ACKed unseen segment] 54135  >  443 [ACK] Seq=1 Ack=2 Win=512 Len=0"
"247","18.174066","192.168.1.20","142.251.37.78","TCP","55","53662  >  443 [ACK] Seq=1 Ack=1 Win=512 Len=1 [TCP segment of a reassembled PDU]"
"248","18.186974","142.251.37.78","192.168.1.20","TCP","66","443  >  53662 [ACK] Seq=1 Ack=2 Win=5201 Len=0 SLE=1 SRE=2"
"249","18.412709","192.168.1.20","146.75.58.248","TLSv1.2","820","Application Data"
"250","18.487031","146.75.58.248","192.168.1.20","TLSv1.2","769","Application Data"
"251","18.487031","146.75.58.248","192.168.1.20","TCP","1510","443  >  54657 [ACK] Seq=167084 Ack=1533 Win=413 Len=1456 [TCP segment of a reassembled PDU]"
"252","18.487031","146.75.58.248","192.168.1.20","TCP","1510","443  >  54657 [ACK] Seq=168540 Ack=1533 Win=413 Len=1456 [TCP segment of a reassembled PDU]"
"253","18.487031","146.75.58.248","192.168.1.20","TCP","1510","443  >  54657 [PSH, ACK] Seq=169996 Ack=1533 Win=413 Len=1456 [TCP segment of a reassembled PDU]"
"254","18.487149","192.168.1.20","146.75.58.248","TCP","54","54657  >  443 [ACK] Seq=1533 Ack=171452 Win=2053 Len=0"
"255","18.490897","146.75.58.248","192.168.1.20","TCP","1510","443  >  54657 [ACK] Seq=171452 Ack=1533 Win=413 Len=1456 [TCP segment of a reassembled PDU]"
"256","18.490897","146.75.58.248","192.168.1.20","TCP","1510","443  >  54657 [ACK] Seq=172908 Ack=1533 Win=413 Len=1456 [TCP segment of a reassembled PDU]"
"257","18.490897","146.75.58.248","192.168.1.20","TCP","1510","443  >  54657 [PSH, ACK] Seq=174364 Ack=1533 Win=413 Len=1456 [TCP segment of a reassembled PDU]"
"258","18.490897","146.75.58.248","192.168.1.20","TCP","1510","443  >  54657 [ACK] Seq=175820 Ack=1533 Win=413 Len=1456 [TCP segment of a reassembled PDU]"
"259","18.490897","146.75.58.248","192.168.1.20","TCP","1510","443  >  54657 [ACK] Seq=177276 Ack=1533 Win=413 Len=1456 [TCP segment of a reassembled PDU]"
"260","18.490897","146.75.58.248","192.168.1.20","TCP","1510","443  >  54657 [PSH, ACK] Seq=178732 Ack=1533 Win=413 Len=1456 [TCP segment of a reassembled PDU]"
"261","18.490897","146.75.58.248","192.168.1.20","TCP","1510","443  >  54657 [ACK] Seq=180188 Ack=1533 Win=413 Len=1456 [TCP segment of a reassembled PDU]"
"262","18.490897","146.75.58.248","192.168.1.20","TCP","1510","443  >  54657 [ACK] Seq=181644 Ack=1533 Win=413 Len=1456 [TCP segment of a reassembled PDU]"
"263","18.490897","146.75.58.248","192.168.1.20","TLSv1.2","1510","Application Data"
"264","18.490897","146.75.58.248","192.168.1.20","TCP","1510","443  >  54657 [ACK] Seq=184556 Ack=1533 Win=413 Len=1456 [TCP segment of a reassembled PDU]"
"265","18.490897","146.75.58.248","192.168.1.20","TCP","1510","443  >  54657 [ACK] Seq=186012 Ack=1533 Win=413 Len=1456 [TCP segment of a reassembled PDU]"
"266","18.490897","146.75.58.248","192.168.1.20","TCP","1510","443  >  54657 [PSH, ACK] Seq=187468 Ack=1533 Win=413 Len=1456 [TCP segment of a reassembled PDU]"
"267","18.491009","192.168.1.20","146.75.58.248","TCP","54","54657  >  443 [ACK] Seq=1533 Ack=188924 Win=2053 Len=0"
"268","18.491588","146.75.58.248","192.168.1.20","TCP","1510","443  >  54657 [ACK] Seq=188924 Ack=1533 Win=413 Len=1456 [TCP segment of a reassembled PDU]"
"269","18.491588","146.75.58.248","192.168.1.20","TCP","1510","443  >  54657 [ACK] Seq=190380 Ack=1533 Win=413 Len=1456 [TCP segment of a reassembled PDU]"
"270","18.491588","146.75.58.248","192.168.1.20","TCP","1510","443  >  54657 [PSH, ACK] Seq=191836 Ack=1533 Win=413 Len=1456 [TCP segment of a reassembled PDU]"
"271","18.491588","146.75.58.248","192.168.1.20","TCP","1510","443  >  54657 [ACK] Seq=193292 Ack=1533 Win=413 Len=1456 [TCP segment of a reassembled PDU]"
"272","18.491648","192.168.1.20","146.75.58.248","TCP","54","54657  >  443 [ACK] Seq=1533 Ack=194748 Win=2053 Len=0"
"273","18.492919","146.75.58.248","192.168.1.20","TCP","1510","443  >  54657 [ACK] Seq=194748 Ack=1533 Win=413 Len=1456 [TCP segment of a reassembled PDU]"
"274","18.492919","146.75.58.248","192.168.1.20","TCP","1510","443  >  54657 [PSH, ACK] Seq=196204 Ack=1533 Win=413 Len=1456 [TCP segment of a reassembled PDU]"
"275","18.492919","146.75.58.248","192.168.1.20","TCP","1510","443  >  54657 [ACK] Seq=197660 Ack=1533 Win=413 Len=1456 [TCP segment of a reassembled PDU]"
"276","18.492919","146.75.58.248","192.168.1.20","TLSv1.2","1510","Application Data"
"277","18.493005","192.168.1.20","146.75.58.248","TCP","54","54657  >  443 [ACK] Seq=1533 Ack=200572 Win=2053 Len=0"
"278","18.493516","146.75.58.248","192.168.1.20","TCP","1510","443  >  54657 [PSH, ACK] Seq=200572 Ack=1533 Win=413 Len=1456 [TCP segment of a reassembled PDU]"
"279","18.493516","146.75.58.248","192.168.1.20","TCP","1510","443  >  54657 [ACK] Seq=202028 Ack=1533 Win=413 Len=1456 [TCP segment of a reassembled PDU]"
"280","18.493516","146.75.58.248","192.168.1.20","TCP","1510","443  >  54657 [ACK] Seq=203484 Ack=1533 Win=413 Len=1456 [TCP segment of a reassembled PDU]"
"281","18.493516","146.75.58.248","192.168.1.20","TCP","1510","443  >  54657 [PSH, ACK] Seq=204940 Ack=1533 Win=413 Len=1456 [TCP segment of a reassembled PDU]"
"282","18.493576","192.168.1.20","146.75.58.248","TCP","54","54657  >  443 [ACK] Seq=1533 Ack=206396 Win=2053 Len=0"
"283","18.495486","146.75.58.248","192.168.1.20","TCP","1510","443  >  54657 [ACK] Seq=206396 Ack=1533 Win=413 Len=1456 [TCP segment of a reassembled PDU]"
"284","18.495486","146.75.58.248","192.168.1.20","TCP","1510","443  >  54657 [ACK] Seq=207852 Ack=1533 Win=413 Len=1456 [TCP segment of a reassembled PDU]"
"285","18.495486","146.75.58.248","192.168.1.20","TCP","1510","443  >  54657 [PSH, ACK] Seq=209308 Ack=1533 Win=413 Len=1456 [TCP segment of a reassembled PDU]"
"286","18.495486","146.75.58.248","192.168.1.20","TCP","1510","443  >  54657 [ACK] Seq=210764 Ack=1533 Win=413 Len=1456 [TCP segment of a reassembled PDU]"
"287","18.495573","192.168.1.20","146.75.58.248","TCP","54","54657  >  443 [ACK] Seq=1533 Ack=212220 Win=2053 Len=0"
"288","18.495634","146.75.58.248","192.168.1.20","TCP","1510","443  >  54657 [ACK] Seq=212220 Ack=1533 Win=413 Len=1456 [TCP segment of a reassembled PDU]"
"289","18.495634","146.75.58.248","192.168.1.20","TCP","1510","443  >  54657 [PSH, ACK] Seq=213676 Ack=1533 Win=413 Len=1456 [TCP segment of a reassembled PDU]"
"290","18.495666","192.168.1.20","146.75.58.248","TCP","54","54657  >  443 [ACK] Seq=1533 Ack=215132 Win=2053 Len=0"
"291","18.496891","146.75.58.248","192.168.1.20","TLSv1.2","1510","Application Data"
"292","18.496891","146.75.58.248","192.168.1.20","TCP","1510","443  >  54657 [ACK] Seq=216588 Ack=1533 Win=413 Len=1456 [TCP segment of a reassembled PDU]"
"293","18.496891","146.75.58.248","192.168.1.20","TCP","1510","443  >  54657 [PSH, ACK] Seq=218044 Ack=1533 Win=413 Len=1456 [TCP segment of a reassembled PDU]"
"294","18.496928","192.168.1.20","146.75.58.248","TCP","54","54657  >  443 [ACK] Seq=1533 Ack=219500 Win=2053 Len=0"
"295","18.498183","146.75.58.248","192.168.1.20","TCP","1510","443  >  54657 [ACK] Seq=219500 Ack=1533 Win=413 Len=1456 [TCP segment of a reassembled PDU]"
"296","18.498183","146.75.58.248","192.168.1.20","TCP","1510","443  >  54657 [ACK] Seq=220956 Ack=1533 Win=413 Len=1456 [TCP segment of a reassembled PDU]"
"297","18.498183","146.75.58.248","192.168.1.20","TCP","1510","443  >  54657 [PSH, ACK] Seq=222412 Ack=1533 Win=413 Len=1456 [TCP segment of a reassembled PDU]"
"298","18.498183","146.75.58.248","192.168.1.20","TCP","1510","443  >  54657 [ACK] Seq=223868 Ack=1533 Win=413 Len=1456 [TCP segment of a reassembled PDU]"
"299","18.498275","192.168.1.20","146.75.58.248","TCP","54","54657  >  443 [ACK] Seq=1533 Ack=225324 Win=2053 Len=0"
"300","18.498690","146.75.58.248","192.168.1.20","TCP","1510","443  >  54657 [ACK] Seq=225324 Ack=1533 Win=413 Len=1456 [TCP segment of a reassembled PDU]"
"301","18.498690","146.75.58.248","192.168.1.20","TCP","1510","443  >  54657 [PSH, ACK] Seq=226780 Ack=1533 Win=413 Len=1456 [TCP segment of a reassembled PDU]"
"302","18.498690","146.75.58.248","192.168.1.20","TCP","1510","443  >  54657 [ACK] Seq=228236 Ack=1533 Win=413 Len=1456 [TCP segment of a reassembled PDU]"
"303","18.498690","146.75.58.248","192.168.1.20","TLSv1.2","1510","Application Data"
"304","18.498734","192.168.1.20","146.75.58.248","TCP","54","54657  >  443 [ACK] Seq=1533 Ack=231148 Win=2053 Len=0"
"305","18.499364","146.75.58.248","192.168.1.20","TLSv1.2","1510","Application Data"
"306","18.499411","192.168.1.20","146.75.58.248","TCP","54","54657  >  443 [ACK] Seq=1533 Ack=232604 Win=2047 Len=0"
"307","18.500439","146.75.58.248","192.168.1.20","TCP","1510","443  >  54657 [ACK] Seq=232604 Ack=1533 Win=413 Len=1456 [TCP segment of a reassembled PDU]"
"308","18.500439","146.75.58.248","192.168.1.20","TCP","1510","443  >  54657 [ACK] Seq=234060 Ack=1533 Win=413 Len=1456 [TCP segment of a reassembled PDU]"
"309","18.500439","146.75.58.248","192.168.1.20","TCP","1510","443  >  54657 [PSH, ACK] Seq=235516 Ack=1533 Win=413 Len=1456 [TCP segment of a reassembled PDU]"
"310","18.500439","146.75.58.248","192.168.1.20","TCP","1510","443  >  54657 [ACK] Seq=236972 Ack=1533 Win=413 Len=1456 [TCP segment of a reassembled PDU]"
"311","18.500490","192.168.1.20","146.75.58.248","TCP","54","54657  >  443 [ACK] Seq=1533 Ack=238428 Win=2053 Len=0"
"312","18.501682","146.75.58.248","192.168.1.20","TCP","1510","443  >  54657 [ACK] Seq=238428 Ack=1533 Win=413 Len=1456 [TCP segment of a reassembled PDU]"
"313","18.501682","146.75.58.248","192.168.1.20","TCP","1510","443  >  54657 [PSH, ACK] Seq=239884 Ack=1533 Win=413 Len=1456 [TCP segment of a reassembled PDU]"
