"No.","Time","Source","Destination","Protocol","Length","Info"
"1","0.000000","2a03:2880:f242:1c7:face:b00c:0:7260","2a06:c701:4f73:a700:9400:aba7:e96d:df75","TCP","781","5222  >  50912 [PSH, ACK] Seq=1 Ack=1 Win=1520 Len=707 [TCP segment of a reassembled PDU]"
"2","0.000000","2a03:2880:f242:1c7:face:b00c:0:7260","2a06:c701:4f73:a700:9400:aba7:e96d:df75","TCP","781","[TCP Retransmission] 5222  >  50912 [PSH, ACK] Seq=1 Ack=1 Win=1520 Len=707"
"3","0.000183","2a06:c701:4f73:a700:9400:aba7:e96d:df75","2a03:2880:f242:1c7:face:b00c:0:7260","TCP","86","50912  >  5222 [ACK] Seq=1 Ack=708 Win=516 Len=0 SLE=1 SRE=708"
"4","0.027187","2a06:c701:4f73:a700:9400:aba7:e96d:df75","2a03:2880:f242:1c7:face:b00c:0:7260","TCP","137","50912  >  5222 [PSH, ACK] Seq=1 Ack=708 Win=516 Len=63 [TCP segment of a reassembled PDU]"
"5","0.077635","2a03:2880:f242:1c7:face:b00c:0:7260","2a06:c701:4f73:a700:9400:aba7:e96d:df75","TCP","74","5222  >  50912 [ACK] Seq=708 Ack=64 Win=1520 Len=0"
"58","9.830194","2a03:2880:f242:1c7:face:b00c:0:7260","2a06:c701:4f73:a700:9400:aba7:e96d:df75","TCP","1466","5222  >  50912 [ACK] Seq=708 Ack=64 Win=1520 Len=1392 [TCP segment of a reassembled PDU]"
"59","9.830194","2a03:2880:f242:1c7:face:b00c:0:7260","2a06:c701:4f73:a700:9400:aba7:e96d:df75","TCP","173","5222  >  50912 [PSH, ACK] Seq=2100 Ack=64 Win=1520 Len=99 [TCP segment of a reassembled PDU]"
"60","9.830194","2a03:2880:f242:1c7:face:b00c:0:7260","2a06:c701:4f73:a700:9400:aba7:e96d:df75","TCP","730","5222  >  50912 [PSH, ACK] Seq=2199 Ack=64 Win=1520 Len=656 [TCP segment of a reassembled PDU]"
"61","9.830384","2a06:c701:4f73:a700:9400:aba7:e96d:df75","2a03:2880:f242:1c7:face:b00c:0:7260","TCP","74","50912  >  5222 [ACK] Seq=64 Ack=2855 Win=516 Len=0"
"62","9.850973","2a06:c701:4f73:a700:9400:aba7:e96d:df75","2a03:2880:f242:1c7:face:b00c:0:7260","TCP","137","50912  >  5222 [PSH, ACK] Seq=64 Ack=2855 Win=516 Len=63 [TCP segment of a reassembled PDU]"
"63","9.898753","2a03:2880:f242:1c7:face:b00c:0:7260","2a06:c701:4f73:a700:9400:aba7:e96d:df75","TCP","74","5222  >  50912 [ACK] Seq=2855 Ack=127 Win=1520 Len=0"
"90","22.731414","2a03:2880:f242:1c7:face:b00c:0:7260","2a06:c701:4f73:a700:9400:aba7:e96d:df75","TCP","941","5222  >  50912 [PSH, ACK] Seq=2855 Ack=127 Win=1520 Len=867 [TCP segment of a reassembled PDU]"
"91","22.756364","2a06:c701:4f73:a700:9400:aba7:e96d:df75","2a03:2880:f242:1c7:face:b00c:0:7260","TCP","137","50912  >  5222 [PSH, ACK] Seq=127 Ack=3722 Win=513 Len=63 [TCP segment of a reassembled PDU]"
"92","22.759173","2a03:2880:f242:1c7:face:b00c:0:7260","2a06:c701:4f73:a700:9400:aba7:e96d:df75","TCP","941","[TCP Spurious Retransmission] 5222  >  50912 [PSH, ACK] Seq=2855 Ack=127 Win=1520 Len=867"
"93","22.759267","2a06:c701:4f73:a700:9400:aba7:e96d:df75","2a03:2880:f242:1c7:face:b00c:0:7260","TCP","86","[TCP Dup ACK 91#1] 50912  >  5222 [ACK] Seq=190 Ack=3722 Win=513 Len=0 SLE=2855 SRE=3722"
"94","22.804256","2a03:2880:f242:1c7:face:b00c:0:7260","2a06:c701:4f73:a700:9400:aba7:e96d:df75","TCP","74","5222  >  50912 [ACK] Seq=3722 Ack=190 Win=1520 Len=0"
"163","38.092257","2a03:2880:f242:1c7:face:b00c:0:7260","2a06:c701:4f73:a700:9400:aba7:e96d:df75","TCP","877","5222  >  50912 [PSH, ACK] Seq=3722 Ack=190 Win=1520 Len=803 [TCP segment of a reassembled PDU]"
"164","38.128021","2a06:c701:4f73:a700:9400:aba7:e96d:df75","2a03:2880:f242:1c7:face:b00c:0:7260","TCP","137","50912  >  5222 [PSH, ACK] Seq=190 Ack=4525 Win=516 Len=63 [TCP segment of a reassembled PDU]"
"165","38.145636","2a03:2880:f242:1c7:face:b00c:0:7260","2a06:c701:4f73:a700:9400:aba7:e96d:df75","TCP","877","[TCP Spurious Retransmission] 5222  >  50912 [PSH, ACK] Seq=3722 Ack=190 Win=1520 Len=803"
"166","38.145714","2a06:c701:4f73:a700:9400:aba7:e96d:df75","2a03:2880:f242:1c7:face:b00c:0:7260","TCP","86","[TCP Dup ACK 164#1] 50912  >  5222 [ACK] Seq=253 Ack=4525 Win=516 Len=0 SLE=3722 SRE=4525"
"167","38.183376","2a03:2880:f242:1c7:face:b00c:0:7260","2a06:c701:4f73:a700:9400:aba7:e96d:df75","TCP","74","5222  >  50912 [ACK] Seq=4525 Ack=253 Win=1520 Len=0"
"185","50.072040","2a03:2880:f242:1c7:face:b00c:0:7260","2a06:c701:4f73:a700:9400:aba7:e96d:df75","TCP","138","5222  >  50912 [PSH, ACK] Seq=4525 Ack=253 Win=1520 Len=64 [TCP segment of a reassembled PDU]"
"187","50.075342","2a06:c701:4f73:a700:9400:aba7:e96d:df75","2a03:2880:f242:1c7:face:b00c:0:7260","TCP","120","50912  >  5222 [PSH, ACK] Seq=253 Ack=4589 Win=516 Len=46 [TCP segment of a reassembled PDU]"
"188","50.123530","2a03:2880:f242:1c7:face:b00c:0:7260","2a06:c701:4f73:a700:9400:aba7:e96d:df75","TCP","74","5222  >  50912 [ACK] Seq=4589 Ack=299 Win=1520 Len=0"
"244","65.121321","2a03:2880:f242:1c7:face:b00c:0:7260","2a06:c701:4f73:a700:9400:aba7:e96d:df75","TCP","877","5222  >  50912 [PSH, ACK] Seq=4589 Ack=299 Win=1520 Len=803 [TCP segment of a reassembled PDU]"
"245","65.143878","2a06:c701:4f73:a700:9400:aba7:e96d:df75","2a03:2880:f242:1c7:face:b00c:0:7260","TCP","137","50912  >  5222 [PSH, ACK] Seq=299 Ack=5392 Win=513 Len=63 [TCP segment of a reassembled PDU]"
"246","65.194856","2a03:2880:f242:1c7:face:b00c:0:7260","2a06:c701:4f73:a700:9400:aba7:e96d:df75","TCP","74","5222  >  50912 [ACK] Seq=5392 Ack=362 Win=1520 Len=0"
"6361","92.261648","2a03:2880:f242:1c7:face:b00c:0:7260","2a06:c701:4f73:a700:9400:aba7:e96d:df75","TCP","1466","5222  >  50912 [ACK] Seq=5392 Ack=362 Win=1520 Len=1392 [TCP segment of a reassembled PDU]"
"6362","92.261648","2a03:2880:f242:1c7:face:b00c:0:7260","2a06:c701:4f73:a700:9400:aba7:e96d:df75","TCP","173","5222  >  50912 [PSH, ACK] Seq=6784 Ack=362 Win=1520 Len=99 [TCP segment of a reassembled PDU]"
"6363","92.261648","2a03:2880:f242:1c7:face:b00c:0:7260","2a06:c701:4f73:a700:9400:aba7:e96d:df75","TCP","618","5222  >  50912 [PSH, ACK] Seq=6883 Ack=362 Win=1520 Len=544 [TCP segment of a reassembled PDU]"
"6364","92.261912","2a06:c701:4f73:a700:9400:aba7:e96d:df75","2a03:2880:f242:1c7:face:b00c:0:7260","TCP","74","50912  >  5222 [ACK] Seq=362 Ack=7427 Win=516 Len=0"
"6365","92.290219","2a06:c701:4f73:a700:9400:aba7:e96d:df75","2a03:2880:f242:1c7:face:b00c:0:7260","TCP","137","50912  >  5222 [PSH, ACK] Seq=362 Ack=7427 Win=516 Len=63 [TCP segment of a reassembled PDU]"
"6366","92.304320","2a03:2880:f242:1c7:face:b00c:0:7260","2a06:c701:4f73:a700:9400:aba7:e96d:df75","TCP","618","[TCP Spurious Retransmission] 5222  >  50912 [PSH, ACK] Seq=6883 Ack=362 Win=1520 Len=544"
"6367","92.304416","2a06:c701:4f73:a700:9400:aba7:e96d:df75","2a03:2880:f242:1c7:face:b00c:0:7260","TCP","86","[TCP Dup ACK 6364#1] 50912  >  5222 [ACK] Seq=425 Ack=7427 Win=516 Len=0 SLE=6883 SRE=7427"
"6368","92.337445","2a03:2880:f242:1c7:face:b00c:0:7260","2a06:c701:4f73:a700:9400:aba7:e96d:df75","TCP","74","5222  >  50912 [ACK] Seq=7427 Ack=425 Win=1520 Len=0"
"13176","117.655720","2a03:2880:f242:1c7:face:b00c:0:7260","2a06:c701:4f73:a700:9400:aba7:e96d:df75","TCP","1466","5222  >  50912 [ACK] Seq=7427 Ack=425 Win=1520 Len=1392 [TCP segment of a reassembled PDU]"
"13177","117.658446","2a03:2880:f242:1c7:face:b00c:0:7260","2a06:c701:4f73:a700:9400:aba7:e96d:df75","TCP","173","5222  >  50912 [PSH, ACK] Seq=8819 Ack=425 Win=1520 Len=99 [TCP segment of a reassembled PDU]"
"13178","117.658446","2a03:2880:f242:1c7:face:b00c:0:7260","2a06:c701:4f73:a700:9400:aba7:e96d:df75","TCP","650","5222  >  50912 [PSH, ACK] Seq=8918 Ack=425 Win=1520 Len=576 [TCP segment of a reassembled PDU]"
"13179","117.658583","2a06:c701:4f73:a700:9400:aba7:e96d:df75","2a03:2880:f242:1c7:face:b00c:0:7260","TCP","74","50912  >  5222 [ACK] Seq=425 Ack=9494 Win=516 Len=0"
"13180","117.686278","2a06:c701:4f73:a700:9400:aba7:e96d:df75","2a03:2880:f242:1c7:face:b00c:0:7260","TCP","137","50912  >  5222 [PSH, ACK] Seq=425 Ack=9494 Win=516 Len=63 [TCP segment of a reassembled PDU]"
"13181","117.734476","2a03:2880:f242:1c7:face:b00c:0:7260","2a06:c701:4f73:a700:9400:aba7:e96d:df75","TCP","74","5222  >  50912 [ACK] Seq=9494 Ack=488 Win=1520 Len=0"
"19567","148.067766","2a03:2880:f242:1c7:face:b00c:0:7260","2a06:c701:4f73:a700:9400:aba7:e96d:df75","TCP","1466","5222  >  50912 [ACK] Seq=9494 Ack=488 Win=1520 Len=1392 [TCP segment of a reassembled PDU]"
"19568","148.068105","2a03:2880:f242:1c7:face:b00c:0:7260","2a06:c701:4f73:a700:9400:aba7:e96d:df75","TCP","173","5222  >  50912 [PSH, ACK] Seq=10886 Ack=488 Win=1520 Len=99 [TCP segment of a reassembled PDU]"
"19569","148.068105","2a03:2880:f242:1c7:face:b00c:0:7260","2a06:c701:4f73:a700:9400:aba7:e96d:df75","TCP","698","5222  >  50912 [PSH, ACK] Seq=10985 Ack=488 Win=1520 Len=624 [TCP segment of a reassembled PDU]"
"19570","148.068223","2a06:c701:4f73:a700:9400:aba7:e96d:df75","2a03:2880:f242:1c7:face:b00c:0:7260","TCP","74","50912  >  5222 [ACK] Seq=488 Ack=11609 Win=516 Len=0"
"19571","148.103216","2a06:c701:4f73:a700:9400:aba7:e96d:df75","2a03:2880:f242:1c7:face:b00c:0:7260","TCP","137","50912  >  5222 [PSH, ACK] Seq=488 Ack=11609 Win=516 Len=63 [TCP segment of a reassembled PDU]"
"19572","148.151005","2a03:2880:f242:1c7:face:b00c:0:7260","2a06:c701:4f73:a700:9400:aba7:e96d:df75","TCP","74","5222  >  50912 [ACK] Seq=11609 Ack=551 Win=1520 Len=0"
"28077","169.878236","2a03:2880:f242:1c7:face:b00c:0:7260","2a06:c701:4f73:a700:9400:aba7:e96d:df75","TCP","925","5222  >  50912 [PSH, ACK] Seq=11609 Ack=551 Win=1520 Len=851 [TCP segment of a reassembled PDU]"
"28078","169.911693","2a06:c701:4f73:a700:9400:aba7:e96d:df75","2a03:2880:f242:1c7:face:b00c:0:7260","TCP","137","50912  >  5222 [PSH, ACK] Seq=551 Ack=12460 Win=513 Len=63 [TCP segment of a reassembled PDU]"
"28079","169.966138","2a03:2880:f242:1c7:face:b00c:0:7260","2a06:c701:4f73:a700:9400:aba7:e96d:df75","TCP","74","5222  >  50912 [ACK] Seq=12460 Ack=614 Win=1520 Len=0"
"33705","183.089037","2a03:2880:f242:1c7:face:b00c:0:7260","2a06:c701:4f73:a700:9400:aba7:e96d:df75","TCP","862","5222  >  50912 [PSH, ACK] Seq=12460 Ack=614 Win=1520 Len=788 [TCP segment of a reassembled PDU]"
"33706","183.109597","2a06:c701:4f73:a700:9400:aba7:e96d:df75","2a03:2880:f242:1c7:face:b00c:0:7260","TCP","137","50912  >  5222 [PSH, ACK] Seq=614 Ack=13248 Win=516 Len=63 [TCP segment of a reassembled PDU]"
"33707","183.118589","2a03:2880:f242:1c7:face:b00c:0:7260","2a06:c701:4f73:a700:9400:aba7:e96d:df75","TCP","862","[TCP Spurious Retransmission] 5222  >  50912 [PSH, ACK] Seq=12460 Ack=614 Win=1520 Len=788"
"33708","183.118636","2a06:c701:4f73:a700:9400:aba7:e96d:df75","2a03:2880:f242:1c7:face:b00c:0:7260","TCP","86","[TCP Dup ACK 33706#1] 50912  >  5222 [ACK] Seq=677 Ack=13248 Win=516 Len=0 SLE=12460 SRE=13248"
"33709","183.157887","2a03:2880:f242:1c7:face:b00c:0:7260","2a06:c701:4f73:a700:9400:aba7:e96d:df75","TCP","74","5222  >  50912 [ACK] Seq=13248 Ack=677 Win=1520 Len=0"
"33717","183.710311","2a06:c701:4f73:a700:9400:aba7:e96d:df75","2a03:2880:f242:1c7:face:b00c:0:7260","TCP","114","50912  >  5222 [PSH, ACK] Seq=677 Ack=13248 Win=516 Len=40 [TCP segment of a reassembled PDU]"
"33720","183.759315","2a03:2880:f242:1c7:face:b00c:0:7260","2a06:c701:4f73:a700:9400:aba7:e96d:df75","TCP","74","5222  >  50912 [ACK] Seq=13248 Ack=717 Win=1520 Len=0"
"33776","183.861518","2a03:2880:f242:1c7:face:b00c:0:7260","2a06:c701:4f73:a700:9400:aba7:e96d:df75","TCP","1302","5222  >  50912 [PSH, ACK] Seq=13248 Ack=717 Win=1520 Len=1228 [TCP segment of a reassembled PDU]"
"33968","183.911069","2a06:c701:4f73:a700:9400:aba7:e96d:df75","2a03:2880:f242:1c7:face:b00c:0:7260","TCP","74","50912  >  5222 [ACK] Seq=717 Ack=14476 Win=511 Len=0"
